name,flooded
袚邪薪褜泻懈薪芯,0
袧芯胁芯懈褕懈屑褋泻芯械,0
袠屑邪薪褌邪褍,0
孝邪泄褘薪褕邪,0
效懈褋褌芯锌芯谢褜械,0
袥械芯薪懈写芯胁泻邪,0
孝邪谢褕懈泻,0
袣邪蟹邪薪褋泻芯械,0
袗泻褋邪泄,0
袙芯褋褏芯写褋泻芯械,0
袘邪泄屑褘褉蟹邪,0
袗屑邪薪写褘泻,0
袞邪薪邪写邪褍褉,0
袠谢褜懈褔褢胁泻邪,0
袣械谢谢械褉芯胁泻邪,0
效械褉薪懈谐芯胁褋泻芯械,0
袣褉邪褋薪邪褟 袩芯谢褟薪邪,0
袛芯斜褉芯卸邪薪芯胁泻邪,0
袚谢褍斜芯泻芯械,0
袧邪谐芯褉薪芯械,0
袛褉褍卸斜邪,0
袛邪褍懈褌,0
袗谢泻邪褌械褉械泻,0
笑械谢懈薪薪芯械,0
袗泻泻褍写褍泻,0
袦邪屑谢褞褌泻邪,0
袩芯泻褉芯胁泻邪,0
袩械褌褉芯锌邪胁谢芯胁褋泻,1
袘褍谢邪械胁芯,0
孝芯泻褍褕懈,0
袩芯谢褍写懈薪芯,0
效懈褋褌芯械,0
袣邪褉邪泻芯谐邪,0
袩褉械褋薪芯胁泻邪,0
袗泄褘褉褌邪褍,0
袥芯斜邪薪芯胁芯,0
袘邪褟薪褌邪泄,0
袣邪蟹邪薪泻邪,0
楔褍泻懈褉谢懈泻,0
袧邪谢芯斜懈薪芯,0
袘芯褋褌邪薪写褘泻,0
袣懈褕泻械薪械泻芯谢褜,0
袗泻卸邪褉泻褘薪,0
袣邪屑褘褕谢芯胁芯,0
袪褍蟹邪械胁泻邪,0
小懈胁泻芯胁泻邪,0
袥芯屑芯薪芯褋芯胁泻邪,0
小褌邪胁褉芯锌芯谢泻邪,0
袘械谢芯械,0
袧芯胁芯薪懈泻芯谢褜褋泻芯械,0
袩械薪褜泻芯胁芯,0
孝邪褏褌邪斜褉芯写,0
袘械褋泻芯谢褜,1
效邪锌邪械胁芯,0
袣褘褉褘屑斜械褌,0
袣芯胁褘谢褜薪芯械,0
小芯泻芯谢芯谐芯褉芯胁泻邪,0
袩褉懈胁芯谢褜薪芯械,0
袗泻邪薪斜褍褉谢褘泻,0
袗泻褕芯泻褘,0
袣褉邪褋薪芯胁芯,0
袣褍褋锌械泻,0
孝懈屑懈褉褟蟹械胁芯,0
袙懈褕薪械胁泻邪,0
携泻芯褉褜,0
袟邪褌芯薪,0
袣褉懈胁芯芯蟹褢褉泻邪,1
孝械锌谢懈褔薪芯械,1
袩褉懈斜褉械卸薪芯械,1
袟薪邪屑械薪褋泻芯械,0
袦懈褏邪泄谢芯胁泻邪,0
袘邪泄褋邪谢,0
袥械薪懈薪褋泻芯械,0
小屑懈褉薪芯胁芯,0
袪芯褖懈薪褋泻芯械,0
袗褉褏邪薪谐械谢褜褋泻芯械,0
袧芯胁芯泻邪屑械薪泻邪,0
袩械褌械褉褎械谢褜写,0
袩芯写谐芯褉薪芯械,0
袘芯谐芯谢褞斜芯胁芯,1
袩褉懈懈褕懈屑泻邪,0
袙芯写芯锌褉芯胁芯写薪芯械,0
袣褉邪褋薪邪褟 袚芯褉泻邪,0
袟芯谢芯褌芯薪芯褕邪,0
效械褉胁芯薪薪芯械,0
袘邪褏屑褍褌,0
袙懈薪芯谐褉邪写芯胁泻邪,0
袦懈褉芯薪芯胁泻邪,0
效械褉屑芯褕薪褟薪泻邪,0
袟械谢褢薪褘泄 袚邪泄,0
携褋薪邪褟 袩芯谢褟薪邪,0
袧芯胁芯锌褉懈褉械褔薪芯械,0
袣邪薪褌械屑懈褉芯胁褋泻芯械,0
袣懈褉芯胁芯,0
袣芯褌芯胁褋泻芯械,0
袦薪芯谐芯褑胁械褌薪芯械,0
孝械薪写懈泻,0
袟邪褉械褔薪芯械,0
袧邪写械卸写懈薪泻邪,0
袨泻褌褟斜褉褜褋泻芯械,0
孝邪锌褕懈谢,0
袘芯谢褜褕芯泄 袠蟹褞屑,0
袛褉邪谐芯屑懈褉芯胁泻邪,0
袠胁邪薪-袚芯褉芯写,0
袨斜褍褏芯胁泻邪,0
袘械谢芯褟褉泻邪,0
袛芯薪械褑泻芯械,0
袣褉邪褋薪芯泻懈械胁泻邪,0
袧芯胁芯谐褉械褔邪薪芯胁泻邪,0
袧芯胁芯写胁芯褉芯胁泻邪,0
袩芯写芯谢褜褋泻芯械,0
袗谐褉芯薪芯屑,0
袠谢褜懈褔,0
袦芯谢芯写芯谐胁邪褉写械泄褋泻芯械,0
袙芯蟹胁褘褕械薪泻邪,0
袟芯谢芯褌邪褟 袧懈胁邪,0
袦械写胁械卸泻邪,0
袧芯胁芯懈胁邪薪芯胁泻邪,0
袘械褉褢蟹芯胁泻邪,0
袚芯褉褜泻芯械,0
袥械褌芯胁芯褔薪芯械,0
袥褞斜懈屑芯胁泻邪,0
袩芯写谢械褋薪芯械,0
孝褉褍写芯胁邪褟 袧懈胁邪,0
袦懈褔褍褉懈薪芯,0
袙芯蟹薪械褋械薪泻邪,0
袧邪写褢卸泻邪,1
袨谢褜褕邪薪泻邪,0
小芯泻芯谢芯胁泻邪,1
袘芯谢褜褕邪褟 袦邪谢褘褕泻邪,1
袣芯泻褌械褉械泻,0
袚褉懈谐芯褉褜械胁泻邪,0
孝褉褍写芯胁芯械,0
袣械薪卸械谐邪谢褘,0
袗褉邪谢邪谐邪褕,0
袪褍斜谢褢胁泻邪,0
袣褉械屑械薪褔褍谐,0
小邪褉褘斜邪泄,0
袗褋邪薪芯胁芯,0
携胁谢械薪泻邪,0
袘懈褉谢懈泻褋泻芯械,0
袝褎懈屑芯胁泻邪,0
孝芯泻褋邪薪 斜懈,0
袧械卸懈薪泻邪,0
小褌邪褉芯斜械谢泻邪,0
袠胁邪薪芯胁泻邪,0
袩芯谢褌邪胁泻邪,0
效械褉泻邪褋褋泻芯械,0
袙谢邪褋芯胁泻邪,0
袣懈褟谢褘,0
楔邪谐邪谢邪谢褘,0
袗褋褌褉邪褏邪薪泻邪,0
袘械褋泻褍写褍泻,0
袙芯谢芯褕懈薪泻邪,0
袨褉薪械泻,0
携褋薪芯胁泻邪,0
袧懈泻芯谢邪械胁泻邪,1
小锌邪褋芯胁泻邪,0
袩械褌褉芯胁泻邪,1
效懈褉懈泻芯胁泻邪,0
孝邪褉邪薪谐褍谢,0
袣芯褉薪械械胁泻邪,0
袘褍谢邪泻,0
袠谢褜懈薪泻邪,0
袟邪谐褉邪写芯胁泻邪,0
袙芯谢芯写邪褉褋泻芯械,0
袞邪褉泻芯谢褜,0
袚邪泄写褍泻芯胁芯,0
袙邪谐褍谢懈薪芯,0
袘褍谐褉芯胁芯械,0
袛芯谢屑邪褌芯胁芯,0
袘邪泄褌械褉械泻,1
袪邪褋褋胁械褌,0
袪褟胁泻懈薪芯,0
袥械斜褟卸褜械,0
袦械褌谢懈褕懈薪芯,0
孝褞屑械薪泻邪,0
孝芯谢屑邪褔械胁泻邪,0
袩谢芯褋泻芯械,0
袚邪胁褉懈薪芯,0
袟邪褉芯褋谢芯械,0
孝邪褕泻械薪褌泻邪,0
袧芯胁芯褌褉芯懈褑泻芯械,0
啸谢械斜芯褉芯斜,0
小褍胁芯褉芯胁泻邪,0
孝懈褖械薪泻芯,0
效懈褋褌芯胁褋泻芯械,0
校泻褉邪懈薪泻邪,0
袦邪泄斜邪谢褘泻,0
袩褍谢械屑械褌芯胁泻邪,0
孝邪屑邪薪褋泻芯械,0
袣芯褋泻芯谢褜,0
小芯胁械褌褋泻芯械,0
楔邪薪写邪泻,0
袩褉懈写芯褉芯卸薪芯械,0
袛芯褋褌褘泻,0
袞邪薪邪卸芯谢,0
袞邪薪邪褌邪谢邪锌,0
校蟹褘薪卸邪褉,0
袛胁懈薪褋泻,0
袥邪胁褉芯胁泻邪,0
袛蟹械褉卸懈薪褋泻芯械,0
袦芯褋泻胁芯褉械褑泻芯械,0
袗薪写褉械械胁泻邪,0
袦邪泻邪褉褜械胁泻邪,0
袩褉械褋薪芯褉械写褍褌褜,0
袛褍斜褉芯胁薪芯械,0
袗褎芯薪褜泻懈薪芯,0
覛褘蟹褘谢卸邪褉 芯褉屑邪薪 褕邪褉褍邪褕褘谢褘覔褘,0
孝械锌谢芯胁褋泻芯械,0
袣谢邪写斜懈薪泻邪,0
袩褔械谢懈薪芯,0
小械薪卸邪褉泻邪,0
袝泻邪褌械褉懈薪芯胁泻邪,0
小胁械褌谢芯械,0
效邪锌邪械胁泻邪,0
袘褍写褢薪薪芯械,0
袣邪斜邪薪褜,0
袣邪谢懈薪芯胁泻邪,0
校蟹褘薪泻芯谢褜,0
袗泄褘屑卸邪薪,0
小胁褟褌芯写褍褏芯胁泻邪,0
袘谢邪谐芯胁械褖械薪泻邪,0
校泻褉邪懈薪褋泻芯械,0
袧芯胁芯械,0
袣邪泄褉邪薪泻芯谢褜,0
袣芯屑褋芯屑芯谢褜褋泻芯械,0
啸屑械谢褜薪懈褑泻芯械,0
2632 泻屑,0
袣褉邪褋薪芯蟹薪邪屑褢薪薪芯械,0
袚芯褉褜泻芯胁褋泻芯械,0
袗褉褘泻斜邪谢褘泻,0
效泻邪谢芯胁芯,0
袧懈卸薪懈泄 袘褍褉谢褍泻,0
袗泄褋邪褉懈薪褋泻芯械,0
袗泻泻褍写褘泻,0
袣邪褉褋邪泻芯胁泻邪,0
楔芯锌褌褘泻芯谢褜,0
携谢褌褘,0
袙械褉褏薪懈泄 袘褍褉谢褍泻,0
袘芯褉芯胁褋泻芯械,0
袣芯薪写褉邪褌芯胁泻邪,0
袠蟹屑邪泄谢芯胁泻邪,0
袗泻褌褍械褋邪泄,0
袘懈写邪泄褘泻,0
袣邪褉邪邪谐邪褕,0
袣褍锌褉懈褟薪芯胁泻邪,0
袗泻斜褍谢邪泻,0
袣邪褉邪褌邪谢,1
蝎褋泻邪泻邪 蝎斜褘褉邪械胁邪,0
袗褉邪泄,0
袥械薪懈薪谐褉邪写褋泻芯械,0
袣褉邪褋薪芯泻邪屑械薪泻邪,0
小邪褍屑邪谢泻芯谢褜,0
袪邪蟹谐褍谢褜薪芯械,0
袙芯褋泻褉械褋械薪芯胁泻邪,0
袣褘蟹褘谢邪褋泻械褉,0
袥械写械薪褢胁芯,0
袘懈泻械,0
袧芯胁芯屑懈褏邪泄谢芯胁泻邪,0
袗覜褋褍邪褌,0
袝褋懈谢褜,0
袗薪褌芯薪芯胁泻邪,0
袚芯褉薪芯械,0
袨褉谢懈薪芯谐芯褉褋泻芯械,0
袘械谢芯谐褉邪写芯胁泻邪,0
袩褉懈芯蟹褢褉薪芯械,0
袛邪褕泻芯-袧懈泻芯谢邪械胁泻邪,0
袣邪褉谢褍谐邪,0
袧芯胁芯锌芯泻褉芯胁泻邪,0
些褍褔褜械,0
袣邪褉邪谐邪薪写褘,0
袘懈薪邪褕,0
袝褉械屑械械胁泻邪,0
袧芯谐邪泄斜邪泄,0
袨斜褉邪蟹械褑,0
袘褍写械薪薪芯械,0
袞邪屑斜褘谢,0
袨薪写懈褉懈褋,0
袣邪泄褉邪褌,0
袦芯褉褌褘泻,0
孝械谢褜卸邪薪,0
袦邪谢褜褑械胁芯,0
袝薪斜械泻,0
袝褋懈谢褜褋泻芯械,0
袘邪褉薪械胁泻邪,0
小械屑懈锌邪谢邪褌薪芯械,0
袩懈褋邪褉械胁泻邪,0
袘邪褋褌芯屑邪褉,0
袙械褋械谢芯胁泻邪,0
袧芯胁芯邪谢械泻褋邪薪写褉芯胁泻邪,0
楔邪褏芯胁褋泻芯械,0
小褌褉械谢褜薪懈泻芯胁泻邪,0
袗泻褋褍,0
袞邪薪邪褋褍,0
袣邪褉邪褋邪泄 斜邪褌褘褉邪,0
袗谐褘薪褌邪泄 斜邪褌褘褉邪,0
袨褉谢芯胁泻邪,0
楔邪谢泻邪褉,0
小褍褏芯褉邪斜芯胁泻邪,0
小褌邪薪芯胁芯械,0
袗谢械泻褋邪薪写褉芯胁泻邪,0
袛邪泄褘薪写褘泻,0
袘械褉械泻械,0
袣邪谢褍谐懈薪芯,0
袘械谢芯胁泻邪,0
袣芯胁邪谢褜,0
孝芯泻褌褘,0
袥懈褌胁懈薪芯胁泻邪,0
小邪谢泻褘薪泻芯谢褜,0
袪褍褏谢芯胁泻邪,0
袚褍褋邪泻芯胁泻邪,0
袦邪褌胁械械胁泻邪,0
袣芯薪褋褌邪薪褌懈薪芯胁泻邪,0
袣褉邪褋薪芯谐芯褉泻邪,0
袚邪谢懈褑懈薪芯,0
袧芯胁芯褍泻褉邪懈薪泻邪,0
袟邪褉褟,0
袞褍屑褘褋褕褘,0
校谐芯谢泻懈,0
袣芯屑邪褉芯胁泻邪,0
袗泻邪薪 褋械褉械,0
袘械褉械褋谢邪胁泻邪,0
袧芯胁芯褋胁械褌谢芯胁泻邪,0
袘邪褟薪,0
楔芯谢邪泻芯蟹械泻,0
袝谐懈薪写褘邪谐邪褕,0
小邪褉褘斜褍谢邪泻,0
楔芯泻泻邪褉邪谐邪泄,0
袦械卸写褍芯蟹褢褉薪芯械,0
袣芯谢械褋薪懈泻芯胁泻邪,0
袝谢械褑泻芯械,0
袗泄褘褉褌邪褍褋泻芯械,0
小褘褉褘屑斜械褌,0
小褍谢褍泻芯谢褜,0
袩褉械泻褉邪褋薪芯械,0
袧懈泻芯谢褜褋泻芯械,0
袧懈泻芯谢褜褋泻芯-袘褍褉谢褍泻褋泻芯械,0
袙褋械胁芯谢芯写芯胁泻邪,0
袘褍褉谢褘泻,0
袗泻褋褢薪芯胁泻邪,0
校泻懈谢懈 蝎斜褘褉邪泄,0
袣褍屑褌芯泻泻械薪,0
袣邪屑褋邪泻褌褘,0
袘懈褉谢械褋褌懈泻,0
袗谢褜卸邪薪,0
袘芯褌邪泄,0
袙褘褋芯泻芯械,0
袣邪褉邪泻邪屑褘褋,0
袛邪褍泻邪褉邪,0
袞邪泻褋褘 袞邪谢谐褘蟹褌邪褍,0
小邪褉褘褋邪泄,0
袩械褌褉芯锌邪胁谢芯胁泻邪,0
袣邪褉谢芯胁泻邪,0
袣褍褌褍蟹芯胁泻邪,0
袣懈褉懈谢谢芯胁泻邪,0
袣邪屑械薪薪褘泄 袘褉芯写,0
小邪褉褘褌褍斜械泻,0
校褟谢褘,0
袗泻褋邪褉褘,0
校谢褜谐懈谢懈,0
孝褍谐褍褉卸邪锌,0
袦邪泄褋泻芯械,0
袣褘蟹褘谢褌褍,0
袣褍谢褘泻芯谢褜,0
袣邪褉邪褕懈谢懈泻,0
袣懈褕懈 袣邪褉邪芯泄,0
袘邪泄褌褍褋,0
袣械薪邪褖褘,0
袗褖懈泻芯谢褜,0
袘械蟹谢械褋薪芯械,0
袣邪褉邪褌芯屑邪褉,0
袗屑邪薪谐械谢褜写褘,0
小褌械锌薪芯械,1
挟卸薪芯械,0
袘芯褉泻懈,0
袘邪褉褘泻芯谢褜,0
袣褍褔泻芯胁泻邪,0
袛芯斜褉芯胁芯谢褜褋泻芯械,0
袧芯胁芯褉芯褋褋懈泄褋泻芯械,0
孝邪谢邪锌泻械褉,0
袙谢邪写懈屑懈褉芯胁泻邪,0
袩芯谢褟泻芯胁泻邪,0
袗屑邪薪谐械谢褜写懈薪褋泻芯械,0
袞邪褉泻邪泄褘薪,0
袦械泻褌械锌,0
袧芯胁芯邪薪写褉械械胁泻邪,0
袘械泻褋械懈褌,0
袥褍谐芯胁芯械,0
孝芯薪泻芯褕褍褉芯胁泻邪,0
袠胁邪薪芯-袩械褌褉芯胁泻邪,0
袥褍蟹懈薪泻邪,0
袗泻褌邪褋,0
袣邪褉邪谐邪泄,0
袗谢邪斜懈械,0
效械褉褍薪芯胁泻邪,0
孝邪褍邪谐邪褕,0
袘懈褉谢懈泻,1
袦邪写械薪懈械褌,0
小邪褉褘屑邪薪,0
校谢褜谐懈,0
袘邪泄屑邪谐邪薪斜械褌邪 袠蟹褌芯谢懈薪邪,0
袗褉褏邪薪谐械谢泻邪,0
袗泄褌褍邪褉,0
袨蟹械褉薪芯械,0
小邪斜懈褌,0
袨谢褜谐芯胁泻邪,0
袘邪褍屑邪薪褋泻芯械,0
袨泻褌褟斜褉褜,0
小懈屑邪泻懈,0
袧芯胁芯褉褘斜懈薪泻邪,0
袦懈褉芯谢褞斜芯胁芯,0
袦懈褉薪芯械,0
袞械谢械蟹薪芯械,0
孝褉芯懈褑泻芯械,0
袦邪谢芯械 袘械谢芯械,0
袚芯薪褔邪褉芯胁泻邪,0
袧芯胁芯谐械芯褉谐懈械胁泻邪,0
袣芯薪写褘斜邪泄,0
袣芯斜械薪褋邪泄,0
袣褍蟹械泻褋邪泄,0
袞邪褋 校谢邪薪,0
袣邪褉邪褌械褉械泻,0
袞邪褋泻邪泄褉邪褌,0
孝谢械褍褋邪泄,0
小褍邪褌泻芯谢褜,0
袞邪褉泻械薪,0
袠薪褌褘屑邪泻,0
袛屑懈褌褉懈械胁泻邪,0
袗泻卸邪薪,0
袪邪泻懈褌薪芯械,0
小械胁械褉薪芯械,0
袛芯泻褍褔邪械胁芯,0
袗泄屑邪泻,0
孝邪谢写褘泻芯谢褜,0
袟芯谢芯褌芯褉褍薪薪芯械,0
袣褉邪褋薪褘泄 携褉,0
袣褍褋褌芯胁芯械,0
袣褉邪褋薪芯褟褉泻邪,0
袞械谢褟泻芯胁芯,0
袝褋锌械褉谢懈,0
小褍屑薪芯械,0
袨褋褌邪薪芯胁芯褔薪褘泄 锌褍薪泻褌 2603 泻屑,0
袨褉褢谢,0
孝芯泻邪褉械胁泻邪,0
袦懈薪泻械褋械褉,0
袛邪褔薪芯械,0
袪邪蟹写芯谢褜薪芯械,0
袧芯胁芯写褍斜褉芯胁薪芯械,0
2629 泻屑,0
袣芯泻邪谢邪卸邪褉,0
效械褉薪芯蟹褍斜芯胁泻邪,0
小褌械褉谢懈褌邪屑邪泻,0
袘褉懈谢褢胁泻邪,0
袪邪懈褋芯胁泻邪,0
校褉芯卸邪泄薪芯械,0
效械褉薪芯斜邪械胁泻邪,0
小邪褉褘邪写褘褉,0
袧芯胁芯褋械谢芯胁泻邪,0
袦褍泻褍褉,0
楔褍泻褘褉泻芯谢褜,0
15 谢械褌 袣邪蟹邪褏褋褌邪薪邪,0
袣芯薪褘褉褋褍,0
袘芯谢褜褕芯泄 孝邪谢褋邪泄,0
小懈屑芯薪芯胁泻邪,0
袣薪褟蟹械胁泻邪,0
袛褍斜褉芯胁泻邪,0
袚邪褉褕懈薪芯,0
袩械褋泻懈,0
袣芯薪褞褏芯胁芯,0
袦邪谢邪褟 袙芯蟹胁褘褕械薪泻邪,0
袛褞褋械泻械,0
小邪褉褘褌芯屑邪褉,0
袞邪褋褌邪褉,0
袣褍褉邪谢邪泄,0
袪芯褖懈薪芯,0
小褍谢褘褕芯泻,0
校褋锌械薪泻邪,0
校胁邪泻芯胁褋泻芯械,0
校蟹褍薪泻芯谢褜,0
袣褍谢芯屑蟹懈薪芯,0
袩褉芯谢械褌邪褉泻邪,0
小邪写芯胁泻邪,0
袪褟褋懈薪泻邪,0
袛胁芯泄薪懈泻懈,0
袗褎邪薪邪褋褜械胁泻邪,0
袞邪谢褌褘褉,0
袦械褉谐械薪,0
袣芯薪芯胁邪谢芯胁泻邪,1
袚芯褉芯写械褑泻芯械,1
袘邪谐邪薪邪褌褘,0
袗泻邪薪斜邪褉邪泻,0
袩芯胁芯蟹芯褔薪芯械,0
袨褉褌邪泻芯谢褜,0
袦械薪械泄,0
袘械谢芯谐谢懈薪泻邪,0
小芯褑懈邪谢,0
袪芯胁薪芯械,0
袗谢泻邪邪谐邪褕,0
袣械薪械褋,0
袗褋褌邪谐邪薪,0
小褌褍锌懈薪泻邪,0
小械屑懈锌芯谢泻邪,0
袘邪谢褍邪薪,0
袣褉械褖械薪泻邪,0
袨谢褜谐懈薪泻邪,0
袘芯谐邪褌褘褉芯胁泻邪,0
袣褉邪褋薪芯写芯谢褜褋泻芯械,0
袧芯胁芯斜械褉褢蟹芯胁泻邪,0
楔褍薪泻褘褉泻芯谢褜,0
孝懈褏芯芯泻械邪薪褋泻芯械,0
袗谢邪斜芯褌邪,0
袦邪泻邪褕械胁泻邪,0
袣褉邪屑邪褌芯褉芯胁泻邪,0
袛懈屑懈褌褉芯胁泻邪,0
孝邪谢邪锌,0
袠褋泻褉邪,0
小芯褋薪芯胁泻邪,0
袧褍褉褘屑斜械褌,0
